{
  "schema_version": 1,
  "candidate_id": "dropbox-camera-v1-2c5454b9a0bdc5a0c86bdeacf2d8e58293d8c1e099787679c0ca7b0b547240f1",
  "event_id": "evt-camera-sample-001",
  "producer_source": "dropbox_camera",
  "file_id": "id:sample-file-id",
  "rev": "rev-sample",
  "source_path": "/camera_uploads/sample.jpg",
  "server_modified": "2026-08-05T10:00:00+00:00",
  "client_modified": "2026-08-05T10:00:00+00:00",
  "discovery_time": "2026-08-05T10:01:00+00:00",
  "original_filename": "sample.jpg",
  "mime_type": "image/jpeg",
  "original_size_bytes": 2048,
  "original_sha256": "52bb3fc60d74a4143ce079bb59406b4a97db052a97fb75dda8f4013b3ea86a4c",
  "width": 1600,
  "height": 1200,
  "exif": {
    "timezone_status": "known",
    "raw_datetime_original": "2026-08-05 12:00:00",
    "offset_time_original": "+03:00",
    "raw_datetime_digitized": "2026-08-05 12:00:00",
    "offset_time_digitized": "+03:00",
    "raw_capture_time": "2026-08-05 12:00:00",
    "capture_timezone_offset": "+03:00",
    "normalized_capture_time": "2026-08-05T12:00:00+03:00",
    "orientation": 1,
    "width": 1600,
    "height": 1200
  },
  "classifier_model": "gpt://model/vision-food-candidate-v1",
  "classifier_prompt_version": "v1",
  "classifier_policy_version": "recall-first-v1",
  "classifier_dataset_version": "golden-v1",
  "classifier_output": {
    "schema_version": 1,
    "decision": "ambiguous",
    "score": 0.81,
    "explanation": "The image shows a dish-like object and a table setup."
  },
  "food_candidate": true,
  "ingest_source": "dropbox_camera",
  "confirmation_required": true,
  "consumption_status": "unknown"
}
